<?xml version="1.0" encoding="UTF-8" standalone="no"?>
<!DOCTYPE settings SYSTEM "settings.dtd">
<settings>
<long name="AppStyle" value="2"/>
<bool name="ConfirmUnsavedFiles" value="False"/>
<bool name="ControlMode" value="False"/>
<bool name="CopyOnStop" value="False"/>
<bool name="TimeStampNewFiles" value="False"/>
  <string name="ControlBoxID" value="Direct Entry (ascii)"/>
  <string name="ToolbarID" value="Direct Entry"/>
</settings>
