<?xml version="1.0" encoding="UTF-8" standalone="no"?>
<!DOCTYPE settings SYSTEM "settings.dtd">
<settings>
<long name="AppStyle" value="0"/>
<long name="EditFontSize" value="20"/>
<long name="EditHeight" value="200"/>
<bool name="ConfirmUnsavedFiles" value="False"/>
<bool name="ControlMode" value="True"/>
<bool name="CopyOnStop" value="True"/>
<bool name="FullScreen" value="True"/>
<bool name="TimeStampNewFiles" value="False"/>
<string name="ControlBoxID" value="Conversation (ascii)"/>
<string name="ToolbarID" value="Conversation"/>
</settings>
